[
  {
    "master_record_version": "2.0.0",
    "batch_id": "a0000000-0000-0000-0000-a00000000001",
    "item_id": "8e44db21-f8d1-4024-a246-e0ac5ff24c9e",
    "item_hash": "8e44db21-f8d1-40",
    "input": {
      "input_url": "https://www.eba.ufmg.br/revistaceib/index.php/imagembrasileira/article/download/331/284/521",
      "title_hint": "Virtudes cardinais da Matriz de Nossa Senhora do Pilar, Ouro Preto",
      "date_hint": "c. 1731–1750",
      "place_hint": "Brazil"
    },
    "webscout": {
      "search_results": [
        {
          "evidence_id": "8e44db21",
          "source_type": "academic_paper",
          "title": "Virtudes cardinais da Matriz de Nossa Senhora do Pilar, Ouro Preto",
          "url": "https://www.eba.ufmg.br/revistaceib/index.php/imagembrasileira/article/download/331/284/521",
          "abnt_citation": "ACADÊMICO DO JULGAMENTO DE OURO PRETO. Identificação das alegorias das virtudes cardeais da Matriz de Nossa Senhora do Pilar. Imagem Brasileira, Belo Horizonte: EBA/UFMG.",
          "iconclass_candidates": [],
          "notes": "Fonte identificada no guia de planejamento; busca web nao executada para piloto.",
          "score": 0.6
        }
      ],
      "summary_evidence": "Fontes identificadas no guia de planejamento; busca web nao executada para piloto.",
      "gaps": [
        "URL institucional definitiva",
        "imagem de alta resolucao",
        "data exata de producao"
      ]
    },
    "iconocode": {
      "pre_iconographic": [
        {
          "motif": "figura feminina alegorica",
          "observed": true,
          "notes": "Personificacao feminina do Estado/justica/republica segundo gramatica europeia."
        },
        {
          "motif": "dispositivo estatal brasileiro",
          "observed": true,
          "notes": "Suporte oficial ou comparador genealogico documentado."
        }
      ],
      "codes": [
        {
          "scheme": "iconclass",
          "notation": "44G411",
          "label": "Republica feminina",
          "code_role": "depicts",
          "confidence": 0.6,
          "evidence_source_id": "8e44db21"
        },
        {
          "scheme": "iconclass",
          "notation": "11M31",
          "label": "Iustitia",
          "code_role": "depicts",
          "confidence": 0.5,
          "evidence_source_id": "8e44db21"
        }
      ],
      "interpretation": [
        {
          "claim_text": "Personificacao feminina do Estado segundo gramatica europeia.",
          "claim_type": "iconographic",
          "status": "tentative",
          "confidence": 0.6
        }
      ],
      "validation": {
        "claim_ledger": [
          {
            "claim_text": "Personificacao feminina do Estado segundo gramatica europeia.",
            "supports": [
              "8e44db21"
            ],
            "contradicts": [],
            "gaps": [
              "imagem primaria de alta resolucao"
            ]
          }
        ]
      },
      "confidence": 0.6
    },
    "purificacao": {
      "desincorporacao": 1,
      "rigidez_postural": 2,
      "dessexualizacao": 2,
      "uniformizacao_facial": 2,
      "heraldizacao": 1,
      "enquadramento_arquitetonico": 3,
      "apagamento_narrativo": 2,
      "monocromatizacao": 1,
      "serialidade": 0,
      "inscricao_estatal": 1,
      "familia_alegorica": "Virtudes",
      "subtipo": "Justiça",
      "atributos_iconograficos": [
        "balanca",
        "espada",
        "outro"
      ],
      "genero_atribuido": "feminino",
      "funcao_juridica": "tribunal_consciencia",
      "vetor_colonial": "luso_brasileiro",
      "hipotese_racial": "Figuras femininas brancas e idealizadas; racialização implícita pela gramática ibérica de virtudes cristãs.",
      "referencia_genealogica": [
        "Ripa_1593_1603",
        "Warner_1985"
      ],
      "capta_declaration": "LPAI v2-capta: scores sao atos interpretativos situados, nao dados neutros.",
      "codebook_version": "2.0.0",
      "pre_freeze_sample": true,
      "subaltern_caution": false,
      "record_metadata": {
        "title": "Virtudes cardinais da Matriz de Nossa Senhora do Pilar, Ouro Preto",
        "date": "c. 1731–1750",
        "creator": "Francisco Xavier de Brito (atribuição)",
        "institution": "Matriz de Nossa Senhora do Pilar, Ouro Preto",
        "country": "Brazil",
        "medium": "Escultura barroca em pedra-sabão / madeira dourada",
        "motif": [
          "Prudência",
          "Justiça",
          "Fortaleza",
          "Temperança",
          "Fé",
          "Esperança",
          "Caridade",
          "Fama"
        ],
        "description": "Conjunto escultórico de virtudes cardinais e teologais no interior da Matriz de Nossa Senhora do Pilar, igreja que funcionava também como espaço de legitimação pública e tribunal de consciência colonial.",
        "url": "https://www.eba.ufmg.br/revistaceib/index.php/imagembrasileira/article/download/331/284/521",
        "thumbnail_url": null,
        "rights": null,
        "citation_abnt": "ACADÊMICO DO JULGAMENTO DE OURO PRETO. Identificação das alegorias das virtudes cardeais da Matriz de Nossa Senhora do Pilar. Imagem Brasileira, Belo Horizonte: EBA/UFMG.",
        "tags": [
          "corpus/core",
          "pais/BR",
          "suporte/escultura",
          "regime/normativo",
          "motivo/virtudes"
        ],
        "regime": "normativo",
        "endurecimento_score": 1.8,
        "coded_at": "2026-06-22T23:51:07Z"
      }
    },
    "exports": {
      "abnt_citations": [
        "ACADÊMICO DO JULGAMENTO DE OURO PRETO. Identificação das alegorias das virtudes cardeais da Matriz de Nossa Senhora do Pilar. Imagem Brasileira, Belo Horizonte: EBA/UFMG."
      ],
      "audit_flags": [
        "piloto-v2",
        "core",
        "barroco-mineiro"
      ]
    },
    "timestamps": {
      "created_at": "2026-06-22T23:51:07Z",
      "updated_at": "2026-06-22T23:51:07Z"
    }
  },
  {
    "master_record_version": "2.0.0",
    "batch_id": "a0000000-0000-0000-0000-a00000000001",
    "item_id": "9647a075-d255-470a-a6a1-9df52af95e9b",
    "item_hash": "9647a075-d255-47",
    "input": {
      "input_url": "https://www.youtube.com/watch?v=TUuDNXMqna0",
      "title_hint": "Cédula de 2.000 réis de 1890 — figura feminina",
      "date_hint": "1890",
      "place_hint": "Brazil"
    },
    "webscout": {
      "search_results": [
        {
          "evidence_id": "9647a075",
          "source_type": "academic_paper",
          "title": "Cédula de 2.000 réis de 1890 — figura feminina",
          "url": "https://www.youtube.com/watch?v=TUuDNXMqna0",
          "abnt_citation": "Casa da Moeda do Brasil. Cédula de 2.000 réis. 1890.",
          "iconclass_candidates": [],
          "notes": "Fonte identificada no guia de planejamento; busca web nao executada para piloto.",
          "score": 0.6
        }
      ],
      "summary_evidence": "Fontes identificadas no guia de planejamento; busca web nao executada para piloto.",
      "gaps": [
        "URL institucional definitiva",
        "imagem de alta resolucao",
        "data exata de producao"
      ]
    },
    "iconocode": {
      "pre_iconographic": [
        {
          "motif": "figura feminina alegorica",
          "observed": true,
          "notes": "Personificacao feminina do Estado/justica/republica segundo gramatica europeia."
        },
        {
          "motif": "dispositivo estatal brasileiro",
          "observed": true,
          "notes": "Suporte oficial ou comparador genealogico documentado."
        }
      ],
      "codes": [
        {
          "scheme": "iconclass",
          "notation": "44G411",
          "label": "Republica feminina",
          "code_role": "depicts",
          "confidence": 0.6,
          "evidence_source_id": "9647a075"
        },
        {
          "scheme": "iconclass",
          "notation": "11M31",
          "label": "Iustitia",
          "code_role": "depicts",
          "confidence": 0.5,
          "evidence_source_id": "9647a075"
        }
      ],
      "interpretation": [
        {
          "claim_text": "Personificacao feminina do Estado segundo gramatica europeia.",
          "claim_type": "iconographic",
          "status": "tentative",
          "confidence": 0.6
        }
      ],
      "validation": {
        "claim_ledger": [
          {
            "claim_text": "Personificacao feminina do Estado segundo gramatica europeia.",
            "supports": [
              "9647a075"
            ],
            "contradicts": [],
            "gaps": [
              "imagem primaria de alta resolucao"
            ]
          }
        ]
      },
      "confidence": 0.6
    },
    "purificacao": {
      "desincorporacao": 2,
      "rigidez_postural": 2,
      "dessexualizacao": 2,
      "uniformizacao_facial": 2,
      "heraldizacao": 2,
      "enquadramento_arquitetonico": 1,
      "apagamento_narrativo": 2,
      "monocromatizacao": 2,
      "serialidade": 3,
      "inscricao_estatal": 3,
      "familia_alegorica": "Nacional",
      "subtipo": "Republica",
      "atributos_iconograficos": [
        "outro"
      ],
      "genero_atribuido": "feminino",
      "funcao_juridica": "moeda_cedula",
      "vetor_colonial": "republicano_brasileiro",
      "hipotese_racial": "A escolha de uma 'típica mulher brasileira' para personificar a República revela tensão entre herança colonial da América alegorizada e projeto de branqueamento civilizacional.",
      "referencia_genealogica": [
        "Souza_2014",
        "Warner_1985"
      ],
      "capta_declaration": "LPAI v2-capta: scores sao atos interpretativos situados, nao dados neutros.",
      "codebook_version": "2.0.0",
      "pre_freeze_sample": true,
      "subaltern_caution": false,
      "record_metadata": {
        "title": "Cédula de 2.000 réis de 1890 — figura feminina",
        "date": "1890",
        "creator": "Império do Brasil / República dos Estados Unidos do Brasil",